Item SerialNumber,Item 이름,Item 설명(아이템 클릭시 이름과 함께 보여줌),"사용가능 여부 (0, 1)","소모성 여부(0, 1)",사용시 적용값(실수),"판매가능여부(0, 1)",판매가(정수)
101,카지노 입장권, 아이템 사용시 관리인을 통해 카지노에 입장할 수 있습니다._동시에 메인퀘스트가 등록됩니다__ps. 아이템 사용 전에 사용인에게 말을 걸어보십시오.,1,1,0,0,0
1001,고기,해당 음식을 먹으면 허기가 50 회복됩니다.,1,1,50,1,1
2001,물고기,해당 음식을 먹으면 허기가 30 회복됩니다.,1,1,30,1,0
3001,달걀,해당 음식을 먹으면 허기가 10 회복됩니다.,1,1,10,1,0
10001,게임 안내문,이 편지를 읽고있다면 당신은 본 게임의 참가자일 것입니다._당신이 무엇을 하던 사람이건 여기서는 중요하지 않습니다_어떻게 해서든 100억을 모아보십시오!_당신의 행운을 빕니다.__참고로 해당 편지지는 비싼 제질이니 파는 것을 권장합니다.,0,0,0,1,1
